turn_index,timestamp,category,message,tool_calls,command_categories,completed_at
63,2026-04-03T15:52:59.277Z,commonality_optimization,"SEE sounds like an optional feature (can be turn on/off) Better move ordering seems optional as well and splitted into 3 subfeatures (at least), all optionals... Better TT seems an improvement in different features... OK for proper LMR and aspiration windows, implementation is missing so plan to implement them Safer null move seems a mandatory improvement for a feature Better time manegement is commonality OK improve ""Better king safety"" but it seems not a configurable unit then",{},{},2026-04-03T15:53:31.187Z
64,2026-04-03T15:56:45.881Z,other,please go this way,"{""exec_command"": 24, ""write_stdin"": 9}","{""exploration"": 14, ""build_run"": 7, ""versioning"": 2, ""process"": 1}",2026-04-03T16:04:49.593Z
65,2026-04-03T18:12:12.857Z,other,go with next steps,"{""update_plan"": 3, ""exec_command"": 35, ""write_stdin"": 7}","{""exploration"": 18, ""build_run"": 7, ""testing"": 2, ""benchmarking"": 8}",2026-04-03T18:27:17.459Z
66,2026-04-03T18:38:27.825Z,benchmarking_comparison,"yes, Run the same updated pruning variant against Stockfish at the earlier ~2200 anchor to see whether the gain survives outside self-play.","{""exec_command"": 20, ""write_stdin"": 22}","{""benchmarking"": 8, ""exploration"": 9, ""build_run"": 2, ""other"": 1}",2026-04-03T19:39:35.928Z
67,2026-04-04T03:47:07.206Z,other,Run the updated phase3_full_post_batch_a against the same 2200 anchor for a fair post-Batch-A comparison.,"{""exec_command"": 10, ""write_stdin"": 26}","{""benchmarking"": 3, ""other"": 1, ""exploration"": 6}",2026-04-04T04:21:32.637Z
68,2026-04-04T07:13:09.799Z,commonality_optimization,Move to TT/time-management work before adding more selective pruning,"{""exec_command"": 41, ""write_stdin"": 6}","{""exploration"": 25, ""testing"": 8, ""benchmarking"": 4, ""build_run"": 4}",2026-04-04T07:25:15.078Z
69,2026-04-04T08:04:26.964Z,feature_completion,"in terms of features truly implemented, what is the current status?","{""exec_command"": 8}","{""build_run"": 3, ""exploration"": 4, ""testing"": 1}",2026-04-04T08:06:32.662Z
70,2026-04-04T08:10:23.179Z,feature_completion,please refactor to have Minimax as a selectable feature... I don't get why Magic Bitboards is not implemented... then implement weak/aliased features,"{""exec_command"": 62, ""update_plan"": 2, ""write_stdin"": 3}","{""versioning"": 2, ""exploration"": 51, ""testing"": 2, ""other"": 2, ""build_run"": 3, ""process"": 2}",
71,2026-04-04T08:21:30.638Z,other,continue...,"{""exec_command"": 56, ""write_stdin"": 16}","{""exploration"": 32, ""testing"": 8, ""build_run"": 11, ""other"": 3, ""process"": 1, ""versioning"": 1}",2026-04-04T09:32:09.000Z
72,2026-04-04T11:07:20.810Z,other,let's go for the next steps you describe,"{""exec_command"": 37, ""write_stdin"": 3}","{""testing"": 7, ""exploration"": 19, ""build_run"": 3, ""versioning"": 8}",2026-04-04T11:18:21.732Z
73,2026-04-04T11:20:42.939Z,commit_documentation,update/commit README,{},{},2026-04-04T11:20:44.028Z
74,2026-04-04T11:28:23.034Z,commit_documentation,update/commit README,"{""exec_command"": 6}","{""versioning"": 5, ""exploration"": 1}",2026-04-04T11:29:57.068Z
75,2026-04-04T11:32:26.961Z,benchmarking_comparison,"please organize a tournament using cluechess-cli across different configurations/variants of the chess engine... let's consider N=3 variants, one is the supposedly the best, one is the supposedly worst, and one is random. All variants should be able to play legal moves end-to-end","{""exec_command"": 31, ""write_stdin"": 12}","{""exploration"": 16, ""benchmarking"": 10, ""build_run"": 3, ""process"": 1, ""testing"": 1}",2026-04-04T11:40:01.104Z
76,2026-04-04T11:41:18.492Z,other,depth=2 does not give the full potential of a variant,"{""exec_command"": 1, ""write_stdin"": 2}","{""benchmarking"": 1}",2026-04-04T11:42:53.551Z
77,2026-04-04T11:49:03.634Z,other,why not larger depth like 20?,{},{},2026-04-04T11:49:13.517Z
78,2026-04-04T11:53:38.010Z,other,"ok, I see... but then using depth=20 for the best variant that seems to ""support"" depth, and only this variant, seems fair... in general, given a variant, I'm expecting to set other ""parameters"" to the supposedly best values (eg depth)",{},{},2026-04-04T11:53:49.343Z
79,2026-04-04T11:55:37.149Z,deep_variability_setup,"please elaborate a feature model for modeling variability of ""setup""... and then design a recommended setup table per variant, and ideally per feature...","{""exec_command"": 33, ""write_stdin"": 3}","{""exploration"": 13, ""testing"": 3, ""other"": 1, ""build_run"": 11, ""versioning"": 1, ""process"": 4}",2026-04-04T12:30:19.347Z
80,2026-04-04T12:33:57.075Z,commit_documentation,"please add a setup section in the main README.md organize a tournament with N=3 (variant, setup), where setup is the best given a variant... and the N=3 variants cover supposedly best, supposedly worst, and a random variant (but best setup)","{""exec_command"": 13, ""write_stdin"": 6}","{""testing"": 2, ""benchmarking"": 2, ""exploration"": 4, ""build_run"": 4, ""other"": 1}",2026-04-04T12:39:45.100Z
81,2026-04-04T13:23:15.074Z,other,it's somehow strange that phase2_10x12_ab_pvs_id is better than the phase3_full_eval (supposedly best)... any idea why?,{},{},2026-04-04T13:23:15.686Z
82,2026-04-04T13:23:20.096Z,other,"no, retry","{""exec_command"": 29, ""write_stdin"": 28}","{""exploration"": 6, ""build_run"": 9, ""benchmarking"": 4, ""other"": 1, ""process"": 8, ""testing"": 1}",2026-04-04T14:06:17.892Z
83,2026-04-04T14:13:34.854Z,commit_documentation,commit and then run a controlled equal-condition tournament for the same 3 variants,"{""exec_command"": 17, ""write_stdin"": 21}","{""versioning"": 4, ""benchmarking"": 4, ""process"": 3, ""build_run"": 1, ""testing"": 4, ""exploration"": 1}",2026-04-04T14:36:07.477Z
84,2026-04-05T06:05:50.250Z,other,go ahead,"{""exec_command"": 9}","{""versioning"": 3, ""benchmarking"": 2, ""exploration"": 3, ""build_run"": 1}",2026-04-05T06:07:58.917Z
85,2026-04-05T06:15:07.918Z,deep_variability_setup,can you organize a relatistic tournament between Stockfish at ~2500 Elo and best supposedly variant (including best setup with high depth)? I'd like to know the current potential of the best SPL variant,"{""exec_command"": 46, ""write_stdin"": 19}","{""benchmarking"": 12, ""exploration"": 14, ""other"": 2, ""testing"": 3, ""build_run"": 7, ""process"": 8}",2026-04-05T08:15:44.714Z
86,2026-04-05T11:41:59.155Z,commonality_optimization,"Improve search efficiency before more feature additions; the depth gap is the dominant issue... is it in the ""commonality"" space?",{},{},2026-04-05T11:42:15.173Z
87,2026-04-05T11:51:26.901Z,commonality_optimization,let's go with commonality optimizations... an objective is indeed to remove the limitation of search depth 5 at 2 s/move,"{""update_plan"": 2, ""exec_command"": 37, ""write_stdin"": 4}","{""exploration"": 25, ""testing"": 7, ""build_run"": 5}",2026-04-05T12:00:22.144Z
88,2026-04-05T12:05:10.015Z,other,go with next steps,"{""update_plan"": 1, ""exec_command"": 50, ""write_stdin"": 18}","{""exploration"": 22, ""build_run"": 11, ""benchmarking"": 7, ""testing"": 6, ""process"": 3, ""versioning"": 1}",2026-04-05T12:29:27.105Z
89,2026-04-05T17:39:21.394Z,commonality_optimization,Add king-square caching and checker/pin awareness to cut repeated attack work in legality/in-check paths. Add TT observability summaries to the match harness and rerun the 2500 comparison cleanly.,"{""exec_command"": 27, ""write_stdin"": 19}","{""exploration"": 15, ""benchmarking"": 3, ""build_run"": 7, ""testing"": 2}",2026-04-05T18:00:55.989Z
90,2026-04-05T18:01:55.464Z,commit_documentation,commit at this step and document,"{""exec_command"": 13}","{""versioning"": 7, ""exploration"": 4, ""build_run"": 1, ""testing"": 1}",2026-04-05T18:04:20.795Z
91,2026-04-05T22:21:01.176Z,benchmarking_comparison,run a larger match against Stockfish ~2500 (maybe 20 games),"{""exec_command"": 2, ""write_stdin"": 7}","{""benchmarking"": 1, ""build_run"": 1}",2026-04-05T22:33:33.433Z
92,2026-04-05T22:55:43.636Z,status_meta,status?,"{""write_stdin"": 1, ""exec_command"": 1}","{""build_run"": 1}",2026-04-05T22:56:09.115Z
93,2026-04-05T23:03:09.046Z,status_meta,status?,"{""write_stdin"": 1, ""exec_command"": 1}","{""build_run"": 1}",2026-04-05T23:03:36.807Z
94,2026-04-05T23:19:03.175Z,status_meta,status?,"{""write_stdin"": 1}",{},2026-04-05T23:19:19.407Z
95,2026-04-05T23:27:24.071Z,status_meta,status?,"{""write_stdin"": 1, ""exec_command"": 2}","{""build_run"": 2}",2026-04-05T23:27:57.011Z
96,2026-04-05T23:29:01.460Z,commit_documentation,commit the 20-game artifacts and then rerun the same 20-game protocol against a stronger anchor,"{""exec_command"": 4}","{""versioning"": 1, ""build_run"": 1, ""benchmarking"": 2}",2026-04-05T23:29:29.409Z
97,2026-04-05T23:36:03.077Z,status_meta,statu?,"{""write_stdin"": 1, ""exec_command"": 1}","{""build_run"": 1}",2026-04-05T23:36:23.992Z
98,2026-04-06T06:47:08.515Z,status_meta,status?,"{""write_stdin"": 1, ""exec_command"": 1}","{""build_run"": 1}",2026-04-06T06:47:44.445Z
99,2026-04-09T18:35:01.400Z,commonality_optimization,"it's time to perform experiments I was thinking especially to derive N variants randomly and show some diversity wrt perft and Elo assessment... and plots some interesting stuff so here is a plan: * Stratified random sampling of many valid variants, then legality + perft + anchored Elo. Please include supposedly worst and best variant, and random one... * Controlled ablations separating feature effects from commonality effects.","{""exec_command"": 3}","{""benchmarking"": 1, ""exploration"": 1, ""build_run"": 1}",2026-04-09T18:36:19.088Z
100,2026-04-09T20:43:11.116Z,other,how is CFG_NEGAMAX implemented? please explain... and review this feature,"{""exec_command"": 10}","{""exploration"": 10}",2026-04-09T20:47:53.938Z
