turn_index,timestamp,category,message,tool_calls,command_categories,completed_at
1,2026-03-01T07:47:17.043Z,feature_modeling,"I'd like to build a feature model (as in software product line) of the variability of chess engine implementation... For this, I'd like to rely on chessprogramming.org which is a unique resource describing many techniques, actual chess engines, etc. Please synthesize such a feature model with automated scripts. Each feature should be traced back to a resource and justified. Keep a cache of downloaded resources of chessprogramming (in a dedicated folder). In addition, I'd like to have a comparison table of chess engines, with supported/unsupported features","{""exec_command"": 4, ""request_user_input"": 4}","{""exploration"": 2, ""build_run"": 1, ""other"": 1}",2026-03-01T07:53:26.283Z
2,2026-03-01T07:53:39.400Z,feature_modeling,"PLEASE IMPLEMENT THIS PLAN: # CPW Variability Mining Pipeline and SPL Feature Model ## Summary Build a Python CLI pipeline that mines `chessprogramming.org` into: 1. A 2-3 level SPL feature model (~150 features) in FeatureIDE XML + JSON. 2. Full traceability for each feature (URL + snippet + confidence + justification rule). 3. An all-engines vs all-modeled-features tri-state matrix (`SUPPORTED`, `UNSUPPORTED_EXPLICIT`, `UNKNOWN`) in Markdown + CSV. 4. A dedicated one-shot local cache of downloaded CPW resources, with offline-first reuse. ## Repository Structure (to create) - `pyproject.toml` with CLI entry point and dependencies. - `src/cpw_variability/cli.py` main CLI. - `src/cpw_variability/config.py` constants, paths, and extraction settings. - `src/cpw_variability/fetcher.py` CPW API/HTML retrieval + cache writes. - `src/cpw_variability/discovery.py` engine/page discovery from CPW. - `src/cpw_variability/parser.py` content normalization, section/token extraction. - `src/cpw_variability/taxonomy_seed.py` seeded SPL skeleton (hybrid approach). - `src/cpw_variability/feature_miner.py` leaf feature extraction and canonicalization. - `src/cpw_variability/evidence.py` trace records and confidence scoring. - `src/cpw_variability/model_builder.py` feature tree + constraints export. - `src/cpw_variability/matrix_builder.py` engine-feature tri-state matrix. - `src/cpw_variability/exporters.py` FeatureIDE XML/JSON/CSV/Markdown writers. - `tests/` unit + fixture-based integration tests. - `data/chessprogramming_cache/` dedicated CPW cache folder. - `outputs/` generated artifacts. ## Public Interfaces / APIs / Types - CLI commands: 1. `cpw-var fetch --seed main --mode snapshot` 2. `cpw-var build-model --depth 3` 3. `cpw-var build-matrix --all-engines --all-features` 4. `cpw-var run-all` - Core types (JSON-serializable): 1. `FeatureNode`: `id`, `name`, `parent_id`, `kind` (`mandatory|optional|or|xor`), `description`. 2. `TraceRecord`: `feature_id`, `source_url`, `source_title`, `snippet`, `confidence`, `rule_id`. 3. `EngineFeatureStatus`: `engine_id`, `feature_id`, `status`, `evidence_ids`. 4. `PageCacheEntry`: `url`, `retrieved_at`, `content_hash`, `source_type` (`api|html`), `local_path`. - Output artifacts: 1. `outputs/feature_model.featureide.xml` 2. `outputs/feature_model.json` 3. `outputs/feature_traces.csv` 4. `outputs/engine_feature_matrix.csv` 5. `outputs/engine_feature_matrix.md` 6. `outputs/run_report.md` (coverage/stats/warnings) ## Detailed Implementation Plan 1. Bootstrap project and dependencies. - Use Python package layout and CLI entry point. - Dependencies: `requests`, `beautifulsoup4`, `lxml`, `pydantic`, `typer`, `rapidfuzz`, `pandas` (CSV/MD export), `pytest`. 2. Implement CPW resource acquisition with one-shot cache. - Cache root fixed to `data/chessprogramming_cache/`. - One-shot policy: never revalidate existing entries; download only missing pages. - Try MediaWiki API first (`api.php`), fallback to HTML page retrieval. - Save raw payloads plus normalized text and manifest index. - Offline behavior: if network unavailable, proceed cache-only; fail only when required page is missing from cache. 3. Implement page discovery. - Discover candidate pages from main/category/index pages. - Detect engine pages from CPW category membership and page patterns. - Build deduplicated page graph with page type tags: `engine`, `technique`, `meta`. 4. Build hybrid feature taxonomy. - Seed top-level SPL groups: `Search`, `Evaluation`, `MoveGeneration`, `BoardRepresentation`, `TranspositionTable`, `TimeManagement`, `Parallelism`, `Endgame`, `Opening`, `Protocol`, `Tuning`, `Pruning/Reductions`. - Mine leaf candidates from headings, bold terms, link anchors, and definitional sentences. - Canonicalize synonymous terms into stable feature IDs. - Keep model at depth 2-3 and target ~150 features. - Initial relation defaults: parent-child optional unless strong rule indicates `or/xor/mandatory`. 5. Add traceability and justification. - For each feature, require at least one `TraceRecord`. - Extract evidence snippet from source sentence/section. - Compute confidence from extraction rule strength + term/context match. - Record `rule_id` explaining why feature was inferred (e.g., heading match, definitional pattern, engine-specific claim). 6. Generate engine-feature matrix. - Engine set: all discovered CPW engines. - Feature set: all modeled features. - Status rules: 1. `SUPPORTED`: explicit positive evidence for engine-feature pair. 2. `UNSUPPORTED_EXPLICIT`: explicit negation or exclusion statement. 3. `UNKNOWN`: no explicit evidence. - Export wide CSV + readable Markdown table with legend. 7. Export model formats. - FeatureIDE XML writer for tree + group semantics. - JSON model writer including nodes, relationships, and linked traces. - Validate output schemas before final write. 8. Add quality checks and run report. - Coverage metrics: traced features %, engines discovered, matrix fill ratios by status. - Warning list: untraced features, low-confidence-only features, ambiguous engine names. ## Test Cases and Scenarios 1. Unit: cache key/path normalization and manifest integrity. 2. Unit: API response parsing and HTML fallback parsing. 3. Unit: feature canonicalization and synonym merging. 4. Unit: tri-state classifier on positive/negative/absent evidence examples. 5. Integration (fixtures): small CPW snapshot -> deterministic feature model JSON and FeatureIDE XML. 6. Integration (fixtures): known engines/features -> expected matrix statuses. 7. E2E offline: run-all with cache-only fixture data succeeds and exports all artifacts. 8. E2E missing-cache: run-all reports actionable missing resources instead of silent failure. ## Acceptance Criteria 1. `cpw-var run-all` generates all six artifacts without manual intervention. 2. Every feature in `feature_model.json` has at least one trace (`feature_traces.csv`). 3. Matrix includes all discovered engines and all modeled features with tri-state values only. 4. Cache exists under `data/chessprogramming_cache/` and is reused on subsequent runs. 5. `run_report.md` includes counts and warnings sufficient for audit. ## Assumptions and Defaults 1. “All engines on CPW” means all pages discoverable as engine pages from CPW categories/indexes during snapshot crawl. 2. One-shot cache policy is strict: no automatic refresh/revalidation. 3. MediaWiki API may be unavailable; HTML fallback is always attempted. 4. Initial constraints in FeatureIDE are conservative (mostly optional) unless explicit evidence supports stricter relations. 5. Current sandbox cannot resolve CPW host; implementation must support cache-first/offline runs and be executable in a network-enabled environment for initial snapshot.","{""exec_command"": 26}","{""other"": 1, ""exploration"": 10, ""testing"": 5, ""benchmarking"": 2, ""build_run"": 7, ""versioning"": 1}",2026-03-01T08:04:04.072Z
3,2026-03-01T08:12:22.519Z,feature_modeling,"I can run on my side, but I'd like to avoid to be a scrapper, and I'm OK to not flood the website... implement a safe strategy, especially resumable with cache","{""exec_command"": 18}","{""exploration"": 13, ""testing"": 3, ""build_run"": 2}",2026-03-01T08:16:24.505Z
4,2026-03-01T09:27:11.190Z,feature_modeling,mathieuacher@Mathieus-MacBook-Pro chessprogramming-vm % PYTHONPATH=src python3 -m cpw_variability.cli fetch \ --seed main \ --mode snapshot \ --max-pages 600 \ --crawl-delay 2.0 \ --http-retries 3 \ --http-backoff 2.0 --fresh Fetched/discovered pages: 600 Warnings: 84 what's next?,{},{},2026-03-01T09:27:36.230Z
5,2026-03-01T10:19:19.056Z,commit_documentation,"please commit everything, including artefacts generated/cached","{""exec_command"": 22, ""write_stdin"": 7}","{""exploration"": 6, ""versioning"": 12, ""build_run"": 1, ""process"": 2, ""other"": 1}",2026-03-01T10:24:10.078Z
6,2026-03-01T10:33:31.232Z,feature_modeling,"now we should significantly improve the pipeline... here is a partial review of the feature model in FeatureIDE for <and name=""BoardRepresentation""> <feature name=""1995[edit]"" /> <feature name=""2000 ...[edit]"" /> <feature name=""2005[edit]"" /> <feature name=""2010[edit]"" /> <feature name=""2015[edit]"" /> <feature name=""Advances in Computer Chess"" /> <feature name=""Array"" /> <feature name=""Assembly"" /> <feature name=""Board Representation"" /> <feature name=""CCC"" /> <feature name=""Compuer Chess Forums"" /> <feature name=""Contents"" /> <feature name=""External Links[edit]"" /> <feature name=""Forum Posts[edit]"" /> <feature name=""Harm Geert Muller"" /> <feature name=""ICGA Journal"" /> <feature name=""index.php"" /> <feature name=""Main Page"" /> <feature name=""Memory"" /> <feature name=""Pieces"" /> <feature name=""Publications[edit]"" /> <feature name=""References[edit]"" /> <feature name=""Robert Hyatt"" /> <feature name=""See also[edit]"" /> <feature name=""Up one Level"" /> first, ""edit"" are pointless with year, eg <feature name=""1995[edit]"" /> <feature name=""References[edit]"" /> is neither a feature <feature name=""Robert Hyatt"" /> is a human/dev/scientist, not a ""feature"" <feature name=""index.php"" /> seriously? <feature name=""Main Page"" /> seriously? we want chess engines-related features I was strongly surprised to not see https://www.chessprogramming.org/0x88 or https://www.chessprogramming.org/Bitboards So it's not really precise at all, with lots of absolutely out of the scope features (if we can talk about features)... and incomplete as well Please revise drastically the approach","{""exec_command"": 46}","{""exploration"": 12, ""build_run"": 25, ""benchmarking"": 1, ""testing"": 7, ""versioning"": 1}",2026-03-01T10:42:39.721Z
7,2026-03-01T14:35:37.916Z,commit_documentation,please commit,"{""exec_command"": 5}","{""versioning"": 5}",2026-03-01T14:35:58.795Z
8,2026-03-01T14:43:23.583Z,feature_modeling,"it's a bit better... though far from perfect... anyway. Now I want a feature model to guide the implementation of a family of chess engines... the goal is that, for each combination of features (configuration), I got a chess engine variant. It can be implemented with compile-time options. Perhaps some run-time options as well, but I would expect it's more rare. So please adapt the mining of a feature model to reflect this perspective and ambition...","{""exec_command"": 30}","{""exploration"": 17, ""testing"": 5, ""build_run"": 7, ""versioning"": 1}",2026-03-01T14:49:46.111Z
9,2026-03-01T14:52:07.654Z,feature_modeling,"let's focus on the feature model: Add explicit cross-tree constraints (requires/excludes) and export them into FeatureIDE <constraints>. and I suspect it's incomplete... can you adapt the scrapping of chess programming to expand a bit the content (""only"" 600 pages so far) and thus augment the feature model?","{""exec_command"": 13}","{""exploration"": 4, ""build_run"": 5, ""testing"": 3, ""versioning"": 1}",2026-03-01T14:56:11.392Z
10,2026-03-01T16:12:35.716Z,other,great! is it possible to increase the max depth to 1?,"{""exec_command"": 2}","{""build_run"": 1, ""testing"": 1}",2026-03-01T16:13:20.145Z
11,2026-03-01T16:21:24.192Z,feature_modeling,oh there is a misunderstanding... depth max 3 (default) was OK... I was targetting the ability to have depth=4,"{""exec_command"": 5}","{""build_run"": 3, ""testing"": 2}",2026-03-01T16:23:52.499Z
12,2026-03-04T23:07:15.851Z,feature_modeling,"leveraging the extracted feature model at depth=4 and mainly using compile-time options (corresponding to features of the feature model), please implement a product line of chess engines in C langage... showcase that out of a valid configuration of the feature model, it is possible to derive/compile the corresponding chess variant, and it should compile/work","{""exec_command"": 48}","{""exploration"": 24, ""build_run"": 9, ""other"": 1, ""testing"": 13, ""versioning"": 1}",2026-03-04T23:14:11.235Z
13,2026-03-04T23:19:25.453Z,feature_completion,I want a real implementation of each feature,"{""exec_command"": 66}","{""exploration"": 22, ""build_run"": 16, ""testing"": 26, ""other"": 1, ""versioning"": 1}",2026-03-04T23:36:07.914Z
14,2026-03-04T23:39:27.297Z,feature_completion,implement full tournament legality” (castling/en-passant/repetition/50-move) and then map additional CPW features on top,"{""exec_command"": 75}","{""exploration"": 34, ""build_run"": 16, ""testing"": 21, ""versioning"": 3, ""other"": 1}",2026-03-04T23:53:14.377Z
15,2026-03-05T06:37:37.430Z,status_meta,go,"{""exec_command"": 19}","{""exploration"": 9, ""testing"": 7, ""build_run"": 3}",2026-03-05T06:41:36.345Z
16,2026-03-05T08:26:38.386Z,spl_implementation,"can we envision to derive one variant, and to make perft pass?","{""exec_command"": 18}","{""testing"": 8, ""exploration"": 7, ""build_run"": 3}",2026-03-05T08:29:56.288Z
17,2026-03-05T08:31:55.230Z,testing_validation,"can you try 5 random configurations/variants, make the perft, and report results on a CSV-like format, where each row is a variant, and features are both features of the variant/chess engine, and then computed results at depth1, 2, 3, 4, and whether it passes or not... time it takes is also interesting","{""exec_command"": 6}","{""build_run"": 4, ""exploration"": 2}",2026-03-05T08:33:55.154Z
18,2026-03-05T08:44:22.323Z,testing_validation,why are variants not passing?,"{""exec_command"": 7}","{""build_run"": 2, ""exploration"": 5}",2026-03-05T08:45:14.620Z
19,2026-03-05T09:59:54.640Z,other,"yes please add the constraint, which seems obvious","{""exec_command"": 11}","{""build_run"": 8, ""exploration"": 2, ""testing"": 1}",2026-03-05T10:01:52.472Z
20,2026-03-05T10:03:27.276Z,testing_validation,can we try perft depth=5? and re-run bench...,"{""exec_command"": 3}","{""build_run"": 2, ""exploration"": 1}",2026-03-05T10:04:17.942Z
21,2026-03-05T10:26:50.127Z,other,let's try with depth 6,"{""exec_command"": 3, ""write_stdin"": 1}","{""build_run"": 2, ""exploration"": 1}",2026-03-05T10:29:15.505Z
22,2026-03-05T10:31:49.444Z,testing_validation,nice! what would be the best configuration/variant for speeding up perft at depth 6?,"{""exec_command"": 2, ""write_stdin"": 1}","{""testing"": 2}",2026-03-05T10:34:39.473Z
23,2026-03-05T10:38:02.027Z,other,can you generate n=5 random chess engines without Castling feature?,"{""exec_command"": 7}","{""build_run"": 1, ""benchmarking"": 3, ""exploration"": 3}",2026-03-05T10:41:12.690Z
24,2026-03-05T10:44:17.820Z,testing_validation,it's reassuring they all fail for perft ;),"{""exec_command"": 3}","{""benchmarking"": 2, ""testing"": 1}",2026-03-05T10:45:23.046Z
25,2026-03-05T10:51:00.206Z,other,why perft_random_variants_no_castling.csv then FAIL?,{},{},2026-03-05T10:51:00.869Z
26,2026-03-05T10:51:14.337Z,other,why perft_random_variants_no_castling.csv then FAIL?,{},{},2026-03-05T10:51:14.771Z
27,2026-03-05T10:51:32.201Z,status_meta,ignore the image...,{},{},2026-03-05T10:51:32.613Z
28,2026-03-05T12:10:34.573Z,other,why perft_random_variants_no_castling.csv then FAIL?,"{""exec_command"": 3}","{""exploration"": 3}",2026-03-05T12:11:05.432Z
29,2026-03-05T12:38:12.433Z,other,oh super nice! isn't it strange to have CFG_MOVE_GENERATION as optional?,{},{},2026-03-05T12:38:43.431Z
30,2026-03-05T12:41:01.164Z,commit_documentation,"yes, please state it's mandatory... please document somewhere the justification of some constraints added and how some features work and their possible impacts eg on perft","{""exec_command"": 8}","{""benchmarking"": 1, ""exploration"": 6, ""build_run"": 1}",2026-03-05T12:42:32.110Z
31,2026-03-05T12:43:14.043Z,commit_documentation,please commit,"{""exec_command"": 5}","{""versioning"": 4, ""testing"": 1}",2026-03-05T12:44:09.180Z
32,2026-03-05T12:50:05.381Z,testing_validation,pick n=3 random chess variants and organize a small tournament among them (check before the perft test),"{""exec_command"": 24, ""write_stdin"": 2}","{""exploration"": 17, ""benchmarking"": 3, ""testing"": 3, ""build_run"": 1}",2026-03-05T12:53:49.512Z
33,2026-03-05T13:06:20.617Z,benchmarking_comparison,"can you add Stockfish (skill 1, lowest Elo possible) as a player? and run again?","{""exec_command"": 12, ""write_stdin"": 4}","{""benchmarking"": 3, ""build_run"": 3, ""exploration"": 6}",2026-03-05T13:10:49.889Z
34,2026-03-05T13:17:01.069Z,benchmarking_comparison,"super nice! let's add two new players, with a stronger Stockfish and a much stronger Stockfish (but below 2200 Elo)","{""exec_command"": 5, ""write_stdin"": 9}","{""build_run"": 1, ""benchmarking"": 2, ""exploration"": 2}",2026-03-05T13:21:30.478Z
35,2026-03-05T13:45:33.699Z,benchmarking_comparison,please add a strong Stockfish 2500 Elo,"{""exec_command"": 4, ""write_stdin"": 12}","{""benchmarking"": 2, ""exploration"": 2}",2026-03-05T13:51:53.157Z
36,2026-03-05T15:12:30.123Z,benchmarking_comparison,"I'd like to redo a proper tournament, with 3 variants of chess engines and 4 Stockfish... the goal is to have a good assessment of Elo of each variant","{""exec_command"": 23, ""write_stdin"": 12}","{""benchmarking"": 7, ""build_run"": 5, ""testing"": 2, ""exploration"": 8, ""versioning"": 1}",
37,2026-03-05T16:26:15.633Z,status_meta,continue,"{""exec_command"": 2}","{""versioning"": 1, ""exploration"": 1}",2026-03-05T16:26:54.253Z
38,2026-03-05T16:29:23.439Z,benchmarking_comparison,"great! try to find 2 best configurations/variants, and run a new tournament with the same players (from scratch)","{""exec_command"": 12, ""write_stdin"": 4}","{""exploration"": 9, ""build_run"": 3}",2026-03-05T16:32:41.785Z
39,2026-03-05T17:16:54.083Z,benchmarking_comparison,"sorry for the misunderstanding, when I say 2 best variants I was thinking: what are the best combinations of features you could do to reach as much Elo as possible?","{""exec_command"": 11, ""write_stdin"": 5}","{""build_run"": 5, ""benchmarking"": 1, ""exploration"": 5}",2026-03-05T17:21:13.124Z
40,2026-03-05T17:25:07.749Z,testing_validation,investigate why there are illegal moves in these variants,"{""exec_command"": 48, ""write_stdin"": 12}","{""exploration"": 24, ""testing"": 6, ""benchmarking"": 7, ""build_run"": 11}",2026-03-05T17:34:40.501Z
41,2026-03-05T17:36:09.983Z,other,"nice, this fix will benefit to many variants I suspect",{},{},2026-03-05T17:36:12.742Z
42,2026-03-05T17:36:27.907Z,other,ok let's assess the two best chess variants,"{""exec_command"": 16, ""write_stdin"": 1}","{""exploration"": 8, ""build_run"": 7, ""benchmarking"": 1}",2026-03-05T17:40:05.378Z
43,2026-03-05T17:42:31.755Z,other,can you improve the strength of some features/variants?,"{""exec_command"": 62, ""write_stdin"": 6}","{""exploration"": 27, ""testing"": 5, ""build_run"": 21, ""benchmarking"": 8, ""versioning"": 1}",2026-03-05T18:13:43.271Z
44,2026-03-05T19:08:52.879Z,benchmarking_comparison,let's go for a tournament,"{""exec_command"": 6, ""write_stdin"": 1}","{""build_run"": 2, ""exploration"": 3, ""benchmarking"": 1}",2026-03-05T19:11:01.331Z
45,2026-03-05T19:41:22.475Z,commit_documentation,please commit and report on current assessment/experiments,"{""exec_command"": 7}","{""versioning"": 2, ""exploration"": 2, ""benchmarking"": 2, ""testing"": 1}",2026-03-05T19:42:40.672Z
46,2026-03-05T21:29:11.796Z,other,"is there a process still running? if yes, why?","{""exec_command"": 2}","{""benchmarking"": 2}",2026-03-05T21:32:29.089Z
47,2026-03-05T21:32:47.684Z,status_meta,yes please,"{""exec_command"": 4}","{""benchmarking"": 3, ""process"": 1}",2026-03-05T21:33:29.157Z
48,2026-04-02T08:59:54.599Z,spl_implementation,"""uses a negamax alpha-beta tree search with pruning and iterative deepening"" is there a configuration that would implement such a chess engine?","{""exec_command"": 2}","{""testing"": 1, ""exploration"": 1}",2026-04-02T09:00:14.605Z
49,2026-04-02T12:29:39.931Z,feature_completion,"OK... there is, I think, a big general issue. the tldr; is that most of the features are simply not fully implemented to say the least... it's just a representative example, but let's consider #if CFG_ALPHA_BETA search_core = ""AlphaBeta""; #elif CFG_NEGAMAX search_core = ""Negamax""; #else search_core = ""Search""; #endif snprintf(out, out_size, ""variant=%s board=%s search=%s"", PL_VARIANT_NAME, board, search_core); basically, CFG_NEGAMAX has only the impact on snprintf... it has no impact on the search strategy if you agree, design a significant plan to truly implement features and their individual combinations","{""exec_command"": 10}","{""exploration"": 9, ""build_run"": 1}",2026-04-02T12:31:37.837Z
50,2026-04-02T12:33:52.656Z,modularity_refactoring,please go with Phase 1... but assess quickly that your modularization pays off and that features can be combined,"{""exec_command"": 28, ""update_plan"": 2, ""write_stdin"": 2}","{""exploration"": 18, ""build_run"": 6, ""testing"": 2, ""benchmarking"": 1, ""versioning"": 1}",2026-04-02T12:53:58.473Z
51,2026-04-02T14:49:46.186Z,modularity_refactoring,let's go to Phase 2,"{""exec_command"": 43, ""write_stdin"": 2}","{""exploration"": 35, ""build_run"": 2, ""testing"": 4, ""other"": 1, ""versioning"": 1}",2026-04-02T15:05:06.647Z
52,2026-04-02T17:01:44.903Z,modularity_refactoring,"a natural challenge is to handle properly feature interactions and how features combined... specifically here, after Phase 1 and Phase 2, we can combine different board representations with different search strategies, but is it really the case? try to test pair-wise combinations","{""exec_command"": 21, ""write_stdin"": 14}","{""exploration"": 14, ""benchmarking"": 1, ""build_run"": 2, ""process"": 4}",2026-04-02T17:07:00.519Z
53,2026-04-02T17:07:24.576Z,commit_documentation,please heavily document and commit,"{""exec_command"": 12}","{""versioning"": 6, ""exploration"": 5, ""testing"": 1}",2026-04-02T17:09:16.681Z
54,2026-04-03T05:11:49.689Z,other,let's move to all these steps,"{""exec_command"": 64, ""update_plan"": 3, ""write_stdin"": 10}","{""exploration"": 35, ""versioning"": 2, ""build_run"": 19, ""testing"": 4, ""process"": 4}",2026-04-03T05:36:02.262Z
55,2026-04-03T12:00:38.484Z,modularity_refactoring,"please go to Extend Phase 3 with richer evaluation subfeatures and stronger evaluation-specific probes... I would day one particular use case is to fully implement a chess engine that ""uses a negamax alpha-beta tree search with pruning and iterative deepening""","{""exec_command"": 21, ""write_stdin"": 2}","{""build_run"": 9, ""exploration"": 8, ""testing"": 3, ""versioning"": 1}",2026-04-03T12:08:02.594Z
56,2026-04-03T12:20:47.344Z,feature_modeling,"Promote some of these new evaluation subfeatures into first-class feature-model options instead of keeping them grouped under the current evaluation flags... It sounds a great direction. Are these subfeatures documented in chessprogramming.org? what do you consider as a ""feature""?","{""exec_command"": 8}","{""build_run"": 6, ""exploration"": 2}",2026-04-03T12:22:41.682Z
57,2026-04-03T12:34:07.198Z,status_meta,please go ahead,"{""exec_command"": 90, ""update_plan"": 1, ""write_stdin"": 15}","{""exploration"": 63, ""build_run"": 22, ""versioning"": 2, ""process"": 1, ""testing"": 2}",2026-04-03T12:56:29.498Z
58,2026-04-03T13:10:58.440Z,commit_documentation,yes promote into proper intermediate groups... and commit,"{""exec_command"": 46, ""write_stdin"": 14}","{""exploration"": 15, ""build_run"": 23, ""testing"": 3, ""versioning"": 5}",2026-04-03T13:28:29.203Z
59,2026-04-03T13:32:59.407Z,benchmarking_comparison,"can you organize a match (10 games say) between the best supposed variants and Stockfish at an interesting skill, says ~2200 (at 120+1 time control, CCRL 40/4 scale) using cutechess-cli?",{},{},2026-04-03T13:32:59.866Z
60,2026-04-03T13:34:22.841Z,status_meta,retry,"{""exec_command"": 32, ""write_stdin"": 27}","{""benchmarking"": 7, ""exploration"": 12, ""build_run"": 8, ""testing"": 2, ""other"": 2, ""process"": 1}",2026-04-03T14:35:40.724Z
61,2026-04-03T15:00:03.483Z,commonality_optimization,"what features should be implemented in priority to improve full (with or without pruning)? or what's part of the ""commonality"" should be improved?","{""exec_command"": 12}","{""exploration"": 9, ""testing"": 3}",2026-04-03T15:03:26.993Z
62,2026-04-03T15:29:26.802Z,commonality_optimization,"you plan to improve: Real SEE Better move ordering Better TT Proper LMR Proper aspiration windows Safer null move Better time management Better king safety / threat eval I have impression some are features (ie configurable units), some are not (like better time management: it seems in the commonality space)",{},{},2026-04-03T15:29:54.762Z
